<?xml version="1.0" encoding="UTF-8"?>
<gelCAN:interventions xmlns:vc="http://www.w3.org/2007/XMLSchema-versioning"
 xmlns:gelCAN="https://genomicsengland.co.uk/xsd/cancer/2.0.0"
 xmlns:xsi="http://www.w3.org/2001/XMLSchema-instance"
 xsi:schemaLocation="https://genomicsengland.co.uk/xsd/cancer/2.0.0 file:/Users/genomicsengland/Documents/Cancer/MainProgrammeCancer/Cancer%20Schemas%20v2.0.0%20FINAL/InterventionsCancer-v2.0.0.xsd">
    <gelCAN:metadata>
        <gelCAN:schema-name>InterventionsCancer</gelCAN:schema-name>
        <gelCAN:schema-version>2.0.0</gelCAN:schema-version>
        <gelCAN:date>2006-05-04</gelCAN:date>
        <gelCAN:source-organisation>source-organisation0</gelCAN:source-organisation>
        <gelCAN:source-system>source-system0</gelCAN:source-system>
        <gelCAN:local-report-id>local-report-id0</gelCAN:local-report-id>
    </gelCAN:metadata>
    <gelCAN:subject>
        <gelCAN:participant-identifiers>
            <gelCAN:participant-id>participant-id0</gelCAN:participant-id>
            <gelCAN:date-of-birth>2006-05-04</gelCAN:date-of-birth>
            <gelCAN:nhs-number>0000000000</gelCAN:nhs-number>
            <gelCAN:chi-number>chi-number0</gelCAN:chi-number>
            <gelCAN:surname>surname0</gelCAN:surname>
            <gelCAN:forenames>forenames0</gelCAN:forenames>
        </gelCAN:participant-identifiers>
        <gelCAN:surgery>
            <gelCAN:event-details>
                <gelCAN:event-date>2006-05-04T18:13:51.0</gelCAN:event-date>
                <gelCAN:event-reference>event-reference0</gelCAN:event-reference>
            </gelCAN:event-details>
            <gelCAN:related-cancer-diagnoses>
                <gelCAN:related-cancer-diagnosis-icd>related-cancer-diagnosis-icd0</gelCAN:related-cancer-diagnosis-icd>
                <gelCAN:related-cancer-diagnosis-icd>related-cancer-diagnosis-icd1</gelCAN:related-cancer-diagnosis-icd>
                <gelCAN:related-cancer-diagnosis-snomedct>related-cancer-diagnosis-snomedct0</gelCAN:related-cancer-diagnosis-snomedct>
                <gelCAN:related-cancer-diagnosis-snomedct>related-cancer-diagnosis-snomedct1</gelCAN:related-cancer-diagnosis-snomedct>
            </gelCAN:related-cancer-diagnoses>
            <gelCAN:main-specialty-code>main-specialty-code0</gelCAN:main-specialty-code>
            <gelCAN:primary-procedure>primary-procedure0</gelCAN:primary-procedure>
            <gelCAN:other-procedures>other-procedures0</gelCAN:other-procedures>
            <gelCAN:other-procedures>other-procedures1</gelCAN:other-procedures>
        </gelCAN:surgery>
        <gelCAN:surgery>
            <gelCAN:event-details>
                <gelCAN:event-date>2006-05-04T18:13:51.0</gelCAN:event-date>
                <gelCAN:event-reference>event-reference1</gelCAN:event-reference>
            </gelCAN:event-details>
            <gelCAN:related-cancer-diagnoses>
                <gelCAN:related-cancer-diagnosis-icd>related-cancer-diagnosis-icd2</gelCAN:related-cancer-diagnosis-icd>
                <gelCAN:related-cancer-diagnosis-icd>related-cancer-diagnosis-icd3</gelCAN:related-cancer-diagnosis-icd>
                <gelCAN:related-cancer-diagnosis-snomedct>related-cancer-diagnosis-snomedct2</gelCAN:related-cancer-diagnosis-snomedct>
                <gelCAN:related-cancer-diagnosis-snomedct>related-cancer-diagnosis-snomedct3</gelCAN:related-cancer-diagnosis-snomedct>
            </gelCAN:related-cancer-diagnoses>
            <gelCAN:main-specialty-code>main-specialty-code1</gelCAN:main-specialty-code>
            <gelCAN:primary-procedure>primary-procedure1</gelCAN:primary-procedure>
            <gelCAN:other-procedures>other-procedures2</gelCAN:other-procedures>
            <gelCAN:other-procedures>other-procedures3</gelCAN:other-procedures>
        </gelCAN:surgery>
        <gelCAN:systemic-anti-cancer-therapy>
            <gelCAN:event-details>
                <gelCAN:event-date>2006-05-04T18:13:51.0</gelCAN:event-date>
                <gelCAN:event-reference>event-reference2</gelCAN:event-reference>
            </gelCAN:event-details>
            <gelCAN:related-cancer-diagnoses>
                <gelCAN:related-cancer-diagnosis-icd>related-cancer-diagnosis-icd4</gelCAN:related-cancer-diagnosis-icd>
                <gelCAN:related-cancer-diagnosis-icd>related-cancer-diagnosis-icd5</gelCAN:related-cancer-diagnosis-icd>
                <gelCAN:related-cancer-diagnosis-snomedct>related-cancer-diagnosis-snomedct4</gelCAN:related-cancer-diagnosis-snomedct>
                <gelCAN:related-cancer-diagnosis-snomedct>related-cancer-diagnosis-snomedct5</gelCAN:related-cancer-diagnosis-snomedct>
            </gelCAN:related-cancer-diagnoses>
            <gelCAN:drug-treatment-intent>D</gelCAN:drug-treatment-intent>
            <gelCAN:drug-regimen>drug-regimen0</gelCAN:drug-regimen>
            <gelCAN:main-specialty-code>main-specialty-code2</gelCAN:main-specialty-code>
        </gelCAN:systemic-anti-cancer-therapy>
        <gelCAN:systemic-anti-cancer-therapy>
            <gelCAN:event-details>
                <gelCAN:event-date>2006-05-04T18:13:51.0</gelCAN:event-date>
                <gelCAN:event-reference>event-reference3</gelCAN:event-reference>
            </gelCAN:event-details>
            <gelCAN:related-cancer-diagnoses>
                <gelCAN:related-cancer-diagnosis-icd>related-cancer-diagnosis-icd6</gelCAN:related-cancer-diagnosis-icd>
                <gelCAN:related-cancer-diagnosis-icd>related-cancer-diagnosis-icd7</gelCAN:related-cancer-diagnosis-icd>
                <gelCAN:related-cancer-diagnosis-snomedct>related-cancer-diagnosis-snomedct6</gelCAN:related-cancer-diagnosis-snomedct>
                <gelCAN:related-cancer-diagnosis-snomedct>related-cancer-diagnosis-snomedct7</gelCAN:related-cancer-diagnosis-snomedct>
            </gelCAN:related-cancer-diagnoses>
            <gelCAN:drug-treatment-intent>D</gelCAN:drug-treatment-intent>
            <gelCAN:drug-regimen>drug-regimen1</gelCAN:drug-regimen>
            <gelCAN:main-specialty-code>main-specialty-code3</gelCAN:main-specialty-code>
        </gelCAN:systemic-anti-cancer-therapy>
        <gelCAN:radiotherapy>
            <gelCAN:event-details>
                <gelCAN:event-date>2006-05-04T18:13:51.0</gelCAN:event-date>
                <gelCAN:event-reference>event-reference4</gelCAN:event-reference>
            </gelCAN:event-details>
            <gelCAN:related-cancer-diagnoses>
                <gelCAN:related-cancer-diagnosis-icd>related-cancer-diagnosis-icd8</gelCAN:related-cancer-diagnosis-icd>
                <gelCAN:related-cancer-diagnosis-icd>related-cancer-diagnosis-icd9</gelCAN:related-cancer-diagnosis-icd>
                <gelCAN:related-cancer-diagnosis-snomedct>related-cancer-diagnosis-snomedct8</gelCAN:related-cancer-diagnosis-snomedct>
                <gelCAN:related-cancer-diagnosis-snomedct>related-cancer-diagnosis-snomedct9</gelCAN:related-cancer-diagnosis-snomedct>
            </gelCAN:related-cancer-diagnoses>
            <gelCAN:radiotherapy-details>
                <gelCAN:external-beam>
                    <gelCAN:external-beam-type>particle_therapy</gelCAN:external-beam-type>
                    <gelCAN:fractions>0</gelCAN:fractions>
                </gelCAN:external-beam>
            </gelCAN:radiotherapy-details>
            <gelCAN:radiotherapy-site>radiotherapy-site0</gelCAN:radiotherapy-site>
            <gelCAN:dose>0</gelCAN:dose>
            <gelCAN:prescription>prescription0</gelCAN:prescription>
            <gelCAN:plan>plan0</gelCAN:plan>
            <gelCAN:radiotherapy-intent>01</gelCAN:radiotherapy-intent>
            <gelCAN:main-specialty-code>main-specialty-code4</gelCAN:main-specialty-code>
        </gelCAN:radiotherapy>
        <gelCAN:radiotherapy>
            <gelCAN:event-details>
                <gelCAN:event-date>2006-05-04T18:13:51.0</gelCAN:event-date>
                <gelCAN:event-reference>event-reference5</gelCAN:event-reference>
            </gelCAN:event-details>
            <gelCAN:related-cancer-diagnoses>
                <gelCAN:related-cancer-diagnosis-icd>related-cancer-diagnosis-icd10</gelCAN:related-cancer-diagnosis-icd>
                <gelCAN:related-cancer-diagnosis-icd>related-cancer-diagnosis-icd11</gelCAN:related-cancer-diagnosis-icd>
                <gelCAN:related-cancer-diagnosis-snomedct>related-cancer-diagnosis-snomedct10</gelCAN:related-cancer-diagnosis-snomedct>
                <gelCAN:related-cancer-diagnosis-snomedct>related-cancer-diagnosis-snomedct11</gelCAN:related-cancer-diagnosis-snomedct>
            </gelCAN:related-cancer-diagnoses>
            <gelCAN:radiotherapy-details>
                <gelCAN:brachytherapy>
                    <gelCAN:brachytherapy-type>BI</gelCAN:brachytherapy-type>
                </gelCAN:brachytherapy>
            </gelCAN:radiotherapy-details>
            <gelCAN:radiotherapy-site>radiotherapy-site1</gelCAN:radiotherapy-site>
            <gelCAN:dose>0</gelCAN:dose>
            <gelCAN:prescription>prescription1</gelCAN:prescription>
            <gelCAN:plan>plan1</gelCAN:plan>
            <gelCAN:radiotherapy-intent>01</gelCAN:radiotherapy-intent>
            <gelCAN:main-specialty-code>main-specialty-code5</gelCAN:main-specialty-code>
        </gelCAN:radiotherapy>
    </gelCAN:subject>
    <gelCAN:subject>
        <gelCAN:participant-identifiers>
            <gelCAN:participant-id>participant-id1</gelCAN:participant-id>
            <gelCAN:date-of-birth>2006-05-04</gelCAN:date-of-birth>
            <gelCAN:nhs-number>0000000000</gelCAN:nhs-number>
            <gelCAN:chi-number>chi-number1</gelCAN:chi-number>
            <gelCAN:surname>surname1</gelCAN:surname>
            <gelCAN:forenames>forenames1</gelCAN:forenames>
        </gelCAN:participant-identifiers>
        <gelCAN:surgery>
            <gelCAN:event-details>
                <gelCAN:event-date>2006-05-04T18:13:51.0</gelCAN:event-date>